{
  "schemaVersion": "1.0",
  "id": "agent_selection_rewriter",
  "type": "agent.config",
  "title": "选中文本改写 Agent",
  "status": "active",
  "agentRole": "writer",
  "promptTemplateId": "prompt_rewrite_selection",
  "inputSchemaId": "schema.ai-selection-preview.input.v1",
  "outputSchemaId": "schema.ai-selection-preview.output.v1",
  "modelProfileId": "model_default",
  "tools": [],
  "limits": { "maxRetries": 1, "timeoutMs": 90000 },
  "createdAt": "2026-07-04T00:00:00.000Z",
  "updatedAt": "2026-07-04T00:00:00.000Z"
}
